[
  {
    "id": "18181818-1818-4181-8181-181818181818",
    "siteId": "11111111-1111-4111-8111-111111111111",
    "name": "Levure aromatique",
    "category": "levure",
    "supplier": "OenoLab",
    "batchNumber": "LV-2604",
    "quantity": 8.5,
    "unit": "kg",
    "minQuantity": 5,
    "expiryDate": "2026-11-30",
    "location": "Magasin froid",
    "createdAt": "2026-05-18T09:00:00.000Z",
    "updatedAt": "2026-05-18T09:00:00.000Z"
  },
  {
    "id": "19191919-1919-4191-8191-191919191919",
    "siteId": "11111111-1111-4111-8111-111111111111",
    "name": "SO2 solution",
    "category": "sulfite",
    "supplier": "QualiChai",
    "batchNumber": "SO2-1206",
    "quantity": 3,
    "unit": "l",
    "minQuantity": 4,
    "expiryDate": "2026-09-15",
    "location": "Armoire securisee",
    "createdAt": "2026-05-18T09:00:00.000Z",
    "updatedAt": "2026-05-18T09:00:00.000Z"
  }
]
